id,package,review,oracle,output-dice,output-jaccard,output-vsm
7c2b0e21-afc9-11e6-93ae-c4b301cdf627,com.danvelazco.fbwrapper,Crashes Downloaded just so I didn't have to use fb messenger. Crashes! Looking for something else!,no,,,
7c2b2af3-afc9-11e6-b5a9-c4b301cdf627,com.danvelazco.fbwrapper,Disappointed This used to be such a great app  but since upgrading to Android 6.0 it has begun freezing and crashing with tiresome regularity  to the point where it's almost unusable now.,no,,,
7c2b2feb-afc9-11e6-869c-c4b301cdf627,com.danvelazco.fbwrapper,Crashes and stalls a lot Crashes and stalls a lot,no,,,
7c2b36ab-afc9-11e6-b155-c4b301cdf627,com.danvelazco.fbwrapper,Bugs Force closes on Droid 2 after 6.0 update. Otherwise phenomenal app  will bump back to five stars after it is fixed,no,,,
7c2b372e-afc9-11e6-afaa-c4b301cdf627,com.danvelazco.fbwrapper,Keeps Crashing My friend download this to my phone. The app is but whenever I'm on the screen goes away. Got to keep logging back on.,no,,,
7c2b4714-afc9-11e6-8340-c4b301cdf627,com.danvelazco.fbwrapper,It's a great minimal permissions app but... It crashes far too often for me.,no,,,
7c2b488f-afc9-11e6-b9b6-c4b301cdf627,com.danvelazco.fbwrapper,Crashes on marshmallow Great app  but crashes every 2 minutes since upgrading droid turbo 2 to android 6.0.,no,,,
7c2b4b07-afc9-11e6-8654-c4b301cdf627,com.danvelazco.fbwrapper,Good  but... Crashes constantly on my Droid Turbo 2 with the Android Marshmallow update. I've been using this app for a fairly long time  and I've never had any problems until now.,no,,,
7c2b4cf8-afc9-11e6-acb6-c4b301cdf627,com.danvelazco.fbwrapper,Prior to Android 6.0  this app worked flawlessly. Now it crashes constantly :(,no,,,
7c2b4d7d-afc9-11e6-bf22-c4b301cdf627,com.danvelazco.fbwrapper,Almost Great idea  but crashes constantly,no,,,
7c2b4e75-afc9-11e6-8cf0-c4b301cdf627,com.danvelazco.fbwrapper,Crashes constantly on 6.0.1,no,,,
7c2b552e-afc9-11e6-8c4a-c4b301cdf627,com.danvelazco.fbwrapper,Latest version force closes Ever since the last updated for this app  I've had nothing but issues with force closes. Running Android 6.0  marshmallow. Really liked the app before these force closes started.,no,,,
7c2b56ab-afc9-11e6-9536-c4b301cdf627,com.danvelazco.fbwrapper,Crashes consistantly Love the app and how lightweight it runs  been using it for almost a year now  but in the last week it's started crashing every time I use it. Never on initial startup  but in the middle of using it. Never with a specific reason either  I could be writing a comment  trying to view a link or just scrolling the timeline and it'll crash at random withing a minute of opening the app.,no,,,
7c2b5af5-afc9-11e6-baab-c4b301cdf627,com.danvelazco.fbwrapper,Better than the Facebook official app No ads  awesome thing. But I think you could make it faster. Also it crashes when I try to full screen a video and when I put add an emotion in the description of something I share  It doesn't appear in the post. But it's an awesome app generally after all  there are no big problems. Keep on the good work.,no,,,
7c2b5b75-afc9-11e6-a523-c4b301cdf627,com.danvelazco.fbwrapper,Keeps crashing Att Lg g4 6.0. I love this app but it keeps crashing now....halp XD,no,,,
7c2b93e8-afc9-11e6-b36b-c4b301cdf627,com.danvelazco.fbwrapper,Not that great This is better than every other Facebook app  but it just severely crashed on me. When I say severely  I mean it locked up as I was typing and completely became unusable. I couldn't access it at all. Then a minute later it showed a pop-up that said tinfoil has basically crashed and I just chose OK instead of reporting. Can't post pictures either. Man this app is bad.,no,,,
7c2bae0c-afc9-11e6-9ff0-c4b301cdf627,com.danvelazco.fbwrapper,Just works! Lg g2 pro. Android 4.4. Used for at least 3 weeks. Installs ok. No force close issues. App works as described. Much better than other alternatives to official app .,no,,,
7c2bae8f-afc9-11e6-be0b-c4b301cdf627,com.danvelazco.fbwrapper,Crashes  locks up  jumpy This app does NOT do what it claims. It's a browser for fb  but it visually shakes  locks up to the point of a restart. Deleting this waste of space.,no,,,
7c2baf05-afc9-11e6-92a6-c4b301cdf627,com.danvelazco.fbwrapper,Crashes Crashes and hangs on galaxy s6,no,,,
7c2bb2f8-afc9-11e6-97ef-c4b301cdf627,com.danvelazco.fbwrapper,Still can't load picture UPDATES OCT 22'15 STILL CAN'T UPLOAD PICTURE FROM THE THE APP TIN FOIL UPDATE Wont let me upload pictures .......Fix that be near great replacement for Facebook  minus that it is crashing couple times in a day at times,no,,,
7c2bfa38-afc9-11e6-95f0-c4b301cdf627,com.danvelazco.fbwrapper,Terrible. Use this to avoid Facebook massively intrusive permissions. Then a couple months ago the app pretty much became useless. Never loads. Constantly crashes. Can't upload with out it locking up and having to start over... no clue why this app turned worthless  used to do everything in spades.,no,,,
e3193edf-bb02-11e6-813c-fa163e345ce9,com.danvelazco.fbwrapper,Crashes and burns Deleted all friends and their posts does not seem to like some native browsers or bein on SD card or maybe needs to have dreaded Messenger installed uninstalled until it improves.,no,,,
c390a52d-bc0a-11e6-a523-fa163e345ce9,com.danvelazco.fbwrapper,Good but crashes & needs reopening Great alternative that has a few issues I hope get ironed out. The occasional crash can be very annoying & tends to happen more some days than others. Good alternative with good speed & features but random crashes make it infuriating at times. But hey it still beats Facebook & messenger that's for sure. I'll take the crashes over those memory hogging battery draining intrusive spy apps any day thankyou. Just find why it crashes & fix it please devs? I had a good time with it the other day with 2crashes.,no,,,
c3c8cc2e-bc0a-11e6-a523-fa163e345ce9,com.danvelazco.fbwrapper,Crappy app Keeps logging me out and making me do photo id checks. Doesn't accurately show the correct comment that was liked. Slow. Crashes and on and on. Facebook in general is getting stale. Time for the next thing.,no,,,
d05ec7bf-dd0b-11e6-a745-fa163e345ce9,com.danvelazco.fbwrapper,Good but can get much better Fix the messenger crash problem and fix so you can watch live streams. The thing that makes me too use this app is that you can choose to get recent news every time you start the app. That's a big plus!,no,,,
8ce8cbf2-e99e-11e6-aa52-fa163e345ce9,com.danvelazco.fbwrapper,Downloaded for fb messenger ability. This crashes the app.,no,,,
22b30294-f30d-11e6-885c-000c29dba5da,com.danvelazco.fbwrapper,Crashing  always crashing  bro we need an update.,no,,,
963f9c93-f8e1-11e6-9220-000c29dba5da,com.danvelazco.fbwrapper,Very fast problem crash report update fix response. Rare top of the heap Dev team.,no,,,